{
  "schema_version": "anchor.ccswitch-route-profile.v1",
  "profile_id": "glm-5.2-max",
  "protocol": "openai_responses",
  "base_url": "https://ark.cn-beijing.volces.com/api/coding/v3",
  "key_env": "ARK_CODING_API_KEY",
  "model_selection": {
    "mode": "manual",
    "manual_model_id": "glm-5-2-260617",
    "force_manual_model": true,
    "discovery_path": "/models",
    "preferred_model_pattern": "^glm-5-2-260617$"
  },
  "reasoning": {
    "field": "reasoning.effort",
    "effort": "max"
  },
  "pricing": {
    "input_per_million": "1.4",
    "output_per_million": "4.4",
    "cache_read_per_million": "0.26",
    "cache_creation_per_million": "0",
    "source": "local CC Switch/models.dev snapshot; glm-5.2 family match",
    "verified_at": "2026-07-17"
  },
  "network": {
    "mode": "direct",
    "proxy_url_env": null,
    "require_physical_route": true
  },
  "route": {
    "listen_address": "127.0.0.1",
    "port": 15731,
    "max_retries": 3,
    "user_agent": "claude-code"
  }
}
